{
  "schema": "cca-physical-robot-v1",
  "status": "measured",
  "robot_model": "mini_mec_robot",
  "measured_at_utc": "2026-08-14T00:00:00Z",
  "measured_by": "user-supplied physical specification",
  "method": "dimensions supplied in millimetres; length and width include the wheels; sensor heights are measured from the ground plane",
  "wheel_radius_m": 0.05,
  "half_length_m": 0.2,
  "half_width_m": 0.2,
  "footprint_radius_m": 0.282842712474619,
  "sensor_mounts": {
    "lidar_height_m": 0.24,
    "camera_height_m": 0.2,
    "lidar_front_edge_distance_m": 0.1,
    "camera_front_edge_distance_m": 0.035,
    "lidar_position_x_m": 0.1,
    "camera_position_x_m": 0.165,
    "camera_pitch_deg": 0.0,
    "camera_pitch_rad": 0.0,
    "pitch_direction": "level"
  },
  "wheel_signs": {
    "fl": 1,
    "fr": 1,
    "rl": 1,
    "rr": 1
  },
  "notes": "The supplied 50 mm radius is interpreted as the wheel radius because this is the radius used by the Mecanum kinematic interface. Camera angle is recorded as 0 degrees (level) relative to the ground-plane direction. Wheel signs are retained from the existing transport convention and must be verified during commissioning; independent dimensional/calibration verification remains required before actuation."
}
